[1m[34m[ 1/11] appendix.qmd[39m[22m
[31m

processing file: appendix.qmd
[39m1/61                     
2/61 [setup]             
3/61                     
4/61 [load-partisan-data]
5/61                     
6/61 [fig-1]             
7/61                     
8/61 [fig-2]             
9/61                     
10/61 [load-crime-data]   
11/61                     
12/61 [fig-3]             
13/61                     
14/61 [fig-4]             
15/61                     
16/61 [fig-5]             
17/61                     
18/61 [fig-6]             
19/61                     
20/61 [fig-7]             
21/61                     
22/61 [load-weather-data] 
23/61                     
24/61 [fig-8]             
25/61                     
26/61 [fig-9]             
27/61                     
28/61 [load-econ-data]    
29/61                     
30/61 [fig-10]            
31/61                     
32/61 [fig-11]            
33/61                     
34/61 [fig-12]            
35/61                     
36/61 [fig-13]            
37/61                     
38/61 [fig-14]            
39/61                     
40/61 [fig-15]            
41/61                     
42/61 [load-ts-data]      
43/61                     
44/61 [fig-16]            
45/61                     
46/61 [fig-17]            
47/61                     
48/61 [fig-18]            
49/61                     
50/61 [fig-19]            
51/61                     
52/61 [fig-20]            
53/61                     
54/61 [fig-21]            
55/61                     
56/61 [fig-22]            
57/61                     
58/61 [fig-23]            
59/61                     
60/61 [fig-24]            
61/61                     
[31moutput file: appendix.knit.md

[39m[1m[34m[ 2/11] conclusion.qmd[39m[22m
[1m[34m[ 3/11] index.qmd[39m[22m
[31m

processing file: index.qmd
[39m1/9                    
2/9 [setup]            
3/9                    
4/9 [cover-viz]        
5/9                    
6/9 [timeline-viz]     
7/9                    
8/9 [economic-overview]
9/9                    
[31moutput file: index.knit.md

[39m[1m[34m[ 4/11] methods.qmd[39m[22m
[31m

processing file: methods.qmd
[39m1/7                   
2/7 [setup]           
3/7                   
4/7 [methods-overview]
5/7                   
6/7 [analysis-flow]   
7/7                   
[31moutput file: methods.knit.md

[39m[1m[34m[ 5/11] references.qmd[39m[22m
[1m[34m[ 6/11] results-crime.qmd[39m[22m
[31m

processing file: results-crime.qmd
[39m1/33                         
2/33 [setup]                 
3/33                         
4/33 [load-data]             
5/33                         
6/33 [anova-pres]            
7/33                         
8/33 [normality-pres]        
9/33                         
10/33 [levene-pres]           
11/33                         
12/33 [anova-table-pres]      
13/33                         
14/33 [pairwise-pres]         
15/33                         
16/33 [crime-trend]           
17/33                         
18/33 [bootstrap-pres]        
19/33                         
20/33 [bootstrap-plot-pres]   
21/33                         
22/33 [anova-midterm]         
23/33                         
24/33 [normality-midterm]     
25/33                         
26/33 [levene-midterm]        
27/33                         
28/33 [anova-table-midterm]   
29/33                         
30/33 [bootstrap-midterm]     
31/33                         
32/33 [bootstrap-plot-midterm]
33/33                         
[31moutput file: results-crime.knit.md

[39m[1m[34m[ 7/11] results-economics.qmd[39m[22m
[31m

processing file: results-economics.qmd
[39m1/39                           
2/39 [setup]                   
3/39                           
4/39 [load-data]               
5/39                           
6/39 [normality-midterm-unemp] 
7/39                           
8/39 [normality-midterm-income]
9/39                           
10/39 [normality-midterm-hpi]   
11/39                           
12/39 [levene-midterm]          
13/39                           
14/39 [normality-pres-unemp]    
15/39                           
16/39 [normality-pres-income]   
17/39                           
18/39 [normality-pres-hpi]      
19/39                           
20/39 [levene-pres]             
21/39                           
22/39 [anova-midterm-unemp]     
23/39                           
24/39 [pairwise-midterm-unemp]  
25/39                           
26/39 [welch-midterm-income]    
27/39                           
28/39 [welch-midterm-hpi]       
29/39                           
30/39 [anova-pres-income]       
31/39                           
32/39 [pairwise-pres-income]    
33/39                           
34/39 [anova-pres-unemp]        
35/39                           
36/39 [anova-pres-hpi]          
37/39                           
38/39 [pairwise-pres-hpi]       
39/39                           
[31moutput file: results-economics.knit.md

[39m[1m[34m[ 8/11] results-partisan.qmd[39m[22m
[31m

processing file: results-partisan.qmd
[39m1/25                    
2/25 [setup]            
3/25                    
4/25 [load-data]        
5/25                    
6/25 [normality-pres]   
7/25                    
8/25 [levene-pres]      
9/25                    
10/25 [welch-anova-pres] 
11/25                    
12/25 [pairwise-pres]    
13/25                    
14/25 [chisq-pres]       
15/25                    
16/25 [normality-midterm]
17/25                    
18/25 [levene-midterm]   
19/25                    
20/25 [anova-midterm]    
21/25                    
22/25 [pairwise-midterm] 
23/25                    
24/25 [chisq-midterm]    
25/25                    
[31moutput file: results-partisan.knit.md

[39m[1m[34m[ 9/11] results-timeseries.qmd[39m[22m
[31m

processing file: results-timeseries.qmd
[39m1/35                           
2/35 [setup]                   
3/35                           
4/35 [load-data]               
5/35                           
6/35 [forecast-summary]        
7/35                           
8/35 [florida-ts-plot]         
9/35                           
10/35 [florida-stationarity]    
11/35                           
12/35 [florida-acf-pacf]        
13/35                           
14/35 [florida-models]          
15/35                           
16/35 [florida-forecast-plot]   
17/35                           
18/35 [california-ts-plot]      
19/35                           
20/35 [california-stationarity] 
21/35                           
22/35 [california-acf-pacf]     
23/35                           
24/35 [california-models]       
25/35                           
26/35 [california-forecast-plot]
27/35                           
28/35 [michigan-ts-plot]        
29/35                           
30/35 [michigan-stationarity]   
31/35                           
32/35 [michigan-models]         
33/35                           
34/35 [michigan-forecast-plot]  
35/35                           
[31moutput file: results-timeseries.knit.md

[39m[1m[34m[10/11] results-weather.qmd[39m[22m
[31m

processing file: results-weather.qmd
[39m1/25                       
2/25 [setup]               
3/25                       
4/25 [load-data]           
5/25                       
6/25 [chi-square-pres]     
7/25                       
8/25 [chi-test-pres]       
9/25                       
10/25 [chi-square-midterm]  
11/25                       
12/25 [chi-test-midterm]    
13/25                       
14/25 [perm-test-pres]      
15/25                       
16/25 [perm-results-pres]   
17/25                       
18/25 [perm-plot-pres]      
19/25                       
20/25 [perm-test-midterm]   
21/25                       
22/25 [perm-results-midterm]
23/25                       
24/25 [perm-plot-midterm]   
25/25                       
[31moutput file: results-weather.knit.md

[39m[1m[34m[11/11] results.qmd[39m[22m
[31m

processing file: results.qmd
[39m1/7                      
2/7 [setup]              
3/7                      
4/7 [results-summary-viz]
5/7                      
6/7 [forecast-viz]       
7/7                      
[31moutput file: results.knit.md

[39m
Output created: docs/index.html

